{
  "schemaVersion": "1.0.0",
  "metadata": {
    "title": "上海小学三年级数学提升蓝图",
    "audience": [
      "三年级学生",
      "家庭陪练家长",
      "后续交互网站开发者"
    ],
    "scope": [
      "上海三年级沪教版课内必会",
      "三年级可理解的数学思维拔高",
      "母题、子题、动画规格、家长陪练话术"
    ],
    "navigationModel": [
      "知识点",
      "母题",
      "子题",
      "动画",
      "练习"
    ],
    "sources": [
      {
        "title": "2026年春季上海市编写教学用书目录",
        "url": "https://www.shpt.gov.cn/zhengwu/yywzgz-jyjzdgz/2026/79/202556.html",
        "use": "确认上海三年级第二学期数学教材线索"
      },
      {
        "title": "2025年秋季上海市编写教学用书目录",
        "url": "https://www.pudong.gov.cn/zwgk/zdgkgw_jyj/2025/251/345431/084b6a50bb8145f881aa547dbba68f1d.pdf",
        "use": "补充上海三年级第一学期教材线索"
      },
      {
        "title": "义务教育数学课程标准（2022年版）",
        "url": "https://www.ictr.edu.cn/Uploads/File/2022/04/28/5.%E4%B9%89%E5%8A%A1%E6%95%99%E8%82%B2%E6%95%B0%E5%AD%A6%E8%AF%BE%E7%A8%8B%E6%A0%87%E5%87%86%EF%BC%882022%E5%B9%B4%E7%89%88%EF%BC%89.20220428160938.pdf",
        "use": "校准第二学段核心素养与内容范围"
      },
      {
        "title": "沪教版三年级上册数学目录",
        "url": "https://www.haoduoyun.cc/book/hjb/shuxue/3s.shtml",
        "use": "细化三年级上册知识点"
      },
      {
        "title": "沪教版三年级下册数学目录",
        "url": "https://www.haoduoyun.cc/book/hjb/shuxue/3x.shtml",
        "use": "细化三年级下册知识点"
      }
    ],
    "assumptions": [
      "项目第一版只交付蓝图和数据源，不实现账号、学习记录、AI批改或完整考试系统。",
      "用户原始描述中的“字体”按“子题/变式题”处理。",
      "拔高题单独标注为提升拓展，不作为校内必考要求。"
    ]
  },
  "knowledgeNodes": [
    {
      "id": "K01",
      "name": "连乘连除",
      "term": "三上复习与提高",
      "source": "课内必会",
      "prerequisites": [
        "乘法口诀",
        "表内除法",
        "整数四则含义"
      ],
      "masteryGoals": [
        "能按从左到右或合理结合完成连乘连除",
        "能解释每一步对应的数量含义"
      ],
      "mistakes": [
        "只按数字大小乱合并",
        "忘记连除的顺序会改变中间含义"
      ]
    },
    {
      "id": "K02",
      "name": "小括号与四则混合运算",
      "term": "三下第一单元",
      "source": "课内必会",
      "prerequisites": [
        "加减乘除",
        "连加连减",
        "连乘连除"
      ],
      "masteryGoals": [
        "能说出先算括号里的部分",
        "能用运算树表示计算顺序"
      ],
      "mistakes": [
        "忽略括号",
        "把应用题中的先后关系和算式顺序混淆"
      ]
    },
    {
      "id": "K03",
      "name": "一位数乘两位数、三位数",
      "term": "三上第二单元",
      "source": "课内必会",
      "prerequisites": [
        "乘法口诀",
        "位值",
        "整十整百乘一位数"
      ],
      "masteryGoals": [
        "能用位值分解解释竖式乘法",
        "能处理进位并验算数量级"
      ],
      "mistakes": [
        "漏写进位",
        "把十位和百位的部分积当成个位"
      ]
    },
    {
      "id": "K04",
      "name": "两位数乘两位数、三位数",
      "term": "三下第四单元",
      "source": "课内必会",
      "prerequisites": [
        "一位数乘多位数",
        "位值分解",
        "面积阵列"
      ],
      "masteryGoals": [
        "能把两位数乘法拆成几十和几的部分积",
        "能用面积阵列理解竖式"
      ],
      "mistakes": [
        "第二行部分积错位",
        "只背竖式不理解每一行含义"
      ]
    },
    {
      "id": "K05",
      "name": "一位数除两位数、三位数",
      "term": "三上第三单元",
      "source": "课内必会",
      "prerequisites": [
        "表内除法",
        "位值",
        "余数"
      ],
      "masteryGoals": [
        "能按高位到低位平均分",
        "能解释商的每一位和余数"
      ],
      "mistakes": [
        "商的位置写错",
        "余数大于或等于除数"
      ]
    },
    {
      "id": "K06",
      "name": "两位数除多位数与试商",
      "term": "三下第五单元",
      "source": "课内必会",
      "prerequisites": [
        "一位数除法",
        "乘法估算",
        "余数意义"
      ],
      "masteryGoals": [
        "能用接近的整十数试商",
        "能根据乘积大小调整商"
      ],
      "mistakes": [
        "试商过大不回调",
        "把估算结果当成准确答案"
      ]
    },
    {
      "id": "K07",
      "name": "乘除互逆与验算",
      "term": "跨三上三下",
      "source": "课内必会",
      "prerequisites": [
        "乘法含义",
        "除法含义"
      ],
      "masteryGoals": [
        "能用乘法验算除法",
        "能根据三量关系求未知量"
      ],
      "mistakes": [
        "只验算数字不验算单位",
        "把被除数、除数、商的位置混淆"
      ]
    },
    {
      "id": "K08",
      "name": "估算与近似",
      "term": "跨三上三下",
      "source": "课标校准",
      "prerequisites": [
        "整十整百",
        "数轴",
        "四舍五入的直觉"
      ],
      "masteryGoals": [
        "能把数看成接近的整十整百进行估算",
        "能判断答案是否合理"
      ],
      "mistakes": [
        "精算前不判断数量级",
        "估算后忘记回到题目要求"
      ]
    },
    {
      "id": "K09",
      "name": "算筹、算盘与计算器",
      "term": "三下第八单元",
      "source": "课内必会",
      "prerequisites": [
        "位值",
        "整数读写",
        "四则运算"
      ],
      "masteryGoals": [
        "能用不同工具表示同一个数",
        "能用计算器检查复杂计算"
      ],
      "mistakes": [
        "把工具操作当成数学关系本身",
        "输入错误后不做数量级检查"
      ]
    },
    {
      "id": "K10",
      "name": "单价、数量、总价",
      "term": "三上复习与提高",
      "source": "课内必会",
      "prerequisites": [
        "乘除互逆",
        "人民币单位",
        "表格阅读"
      ],
      "masteryGoals": [
        "能在三量中已知两个求第三个",
        "能把题目中的商品关系转化为乘除式"
      ],
      "mistakes": [
        "把单价和总价混淆",
        "单位没有对应到每件、几件、共多少"
      ]
    },
    {
      "id": "K11",
      "name": "速度、时间、路程",
      "term": "三下第三单元",
      "source": "课内必会",
      "prerequisites": [
        "乘除互逆",
        "时间单位",
        "长度单位"
      ],
      "masteryGoals": [
        "能用路程等于速度乘时间建模",
        "能在三量中灵活求未知量"
      ],
      "mistakes": [
        "速度单位和时间单位不匹配",
        "把已经走的路程和剩余路程混淆"
      ]
    },
    {
      "id": "K12",
      "name": "火车过桥与隧道",
      "term": "拔高应用",
      "source": "提升拓展",
      "prerequisites": [
        "速度时间路程",
        "长度加法",
        "线段图"
      ],
      "masteryGoals": [
        "能区分车头到达和整车通过",
        "能用车长加桥长或隧道长表示总路程"
      ],
      "mistakes": [
        "只算桥长不加车长",
        "不清楚题目问车头还是车尾"
      ]
    },
    {
      "id": "K13",
      "name": "和差倍线段图",
      "term": "拔高应用",
      "source": "提升拓展",
      "prerequisites": [
        "加减关系",
        "倍数关系",
        "线段图"
      ],
      "masteryGoals": [
        "能用线段表示多、少、倍",
        "能先求一份量再求各量"
      ],
      "mistakes": [
        "把差当成一份量",
        "线段图没有对齐同一起点"
      ]
    },
    {
      "id": "K14",
      "name": "归一归总",
      "term": "拔高应用",
      "source": "提升拓展",
      "prerequisites": [
        "乘除互逆",
        "单价数量总价",
        "份数思想"
      ],
      "masteryGoals": [
        "能先求一份量或总量",
        "能识别同效率、同单价、同速度情境"
      ],
      "mistakes": [
        "没有判断先求一份还是总份",
        "不同单位的份数直接相乘"
      ]
    },
    {
      "id": "K15",
      "name": "植树与排队点段关系",
      "term": "三上数学广场",
      "source": "提升拓展",
      "prerequisites": [
        "间隔",
        "线段图",
        "加减一"
      ],
      "masteryGoals": [
        "能区分两端都种、只一端、两端不种、环形",
        "能把点和间隔对应起来"
      ],
      "mistakes": [
        "树的棵数和间隔数混淆",
        "直线和环形用同一个公式"
      ]
    },
    {
      "id": "K16",
      "name": "周期问题",
      "term": "三上数学广场",
      "source": "提升拓展",
      "prerequisites": [
        "除法余数",
        "规律观察",
        "序号"
      ],
      "masteryGoals": [
        "能找出重复组",
        "能用余数判断落在哪一项"
      ],
      "mistakes": [
        "从0开始和从1开始的序号混乱",
        "余数为0时选错周期末项"
      ]
    },
    {
      "id": "K17",
      "name": "流程图推理",
      "term": "三上数学广场",
      "source": "提升拓展",
      "prerequisites": [
        "四则运算",
        "逆运算",
        "条件判断"
      ],
      "masteryGoals": [
        "能按箭头顺推结果",
        "能用逆运算反推输入"
      ],
      "mistakes": [
        "漏走分支条件",
        "逆推时运算符号没有反过来"
      ]
    },
    {
      "id": "K18",
      "name": "搭配问题",
      "term": "三下数学广场",
      "source": "课内必会",
      "prerequisites": [
        "分类",
        "有序枚举",
        "乘法意义"
      ],
      "masteryGoals": [
        "能用表格或连线不重不漏枚举",
        "能用乘法表示几类选择的组合数"
      ],
      "mistakes": [
        "重复计数",
        "漏掉某一类选择"
      ]
    },
    {
      "id": "K19",
      "name": "数苹果与放苹果",
      "term": "三下数学广场",
      "source": "课内必会",
      "prerequisites": [
        "有序枚举",
        "加法分解",
        "分类讨论"
      ],
      "masteryGoals": [
        "能按顺序列出分配方案",
        "能区分盒子是否有区别、是否允许空盒"
      ],
      "mistakes": [
        "把相同分法重复计算",
        "没有读清是否每盒至少一个"
      ]
    },
    {
      "id": "K20",
      "name": "鸡兔同笼",
      "term": "拔高应用",
      "source": "提升拓展",
      "prerequisites": [
        "乘除互逆",
        "假设法",
        "差额思想"
      ],
      "masteryGoals": [
        "能用全鸡或全兔假设建立腿数差",
        "能解释每换一只动物腿数改变2条"
      ],
      "mistakes": [
        "腿数差除以4",
        "算出兔后忘记用总只数求鸡"
      ]
    },
    {
      "id": "K21",
      "name": "盈亏调整",
      "term": "拔高应用",
      "source": "提升拓展",
      "prerequisites": [
        "差额思想",
        "份数",
        "除法"
      ],
      "masteryGoals": [
        "能把两种分配方案的差合并",
        "能用总差除以每份差求份数"
      ],
      "mistakes": [
        "只看盈或亏的一边",
        "每份差和总差混淆"
      ]
    },
    {
      "id": "K22",
      "name": "年月日与平闰年",
      "term": "三上第四单元",
      "source": "课内必会",
      "prerequisites": [
        "时间单位",
        "除法",
        "日历阅读"
      ],
      "masteryGoals": [
        "能判断大月、小月、二月天数",
        "能按规则判断平年和闰年"
      ],
      "mistakes": [
        "所有双数月都当小月",
        "闰年规则只记4年一闰而忽略整百年"
      ]
    },
    {
      "id": "K23",
      "name": "经过时间",
      "term": "三上第四单元",
      "source": "课内必会",
      "prerequisites": [
        "时分秒",
        "24时计时法",
        "加减法"
      ],
      "masteryGoals": [
        "能用时间轴计算同日经过时间",
        "能处理跨上午下午和跨日情境"
      ],
      "mistakes": [
        "12时制和24时制混用",
        "跨小时借位错误"
      ]
    },
    {
      "id": "K24",
      "name": "整体与部分",
      "term": "三下第七单元",
      "source": "课内必会",
      "prerequisites": [
        "平均分",
        "整体对象",
        "份数"
      ],
      "masteryGoals": [
        "能指出单位1是什么",
        "能把整体平均分成若干份"
      ],
      "mistakes": [
        "没有确定整体就比较分数",
        "把不同整体的部分直接比较"
      ]
    },
    {
      "id": "K25",
      "name": "几分之一与几分之几",
      "term": "三下第七单元",
      "source": "课内必会",
      "prerequisites": [
        "整体与部分",
        "平均分",
        "份数"
      ],
      "masteryGoals": [
        "能用分母表示平均分的份数",
        "能用分子表示取了几份"
      ],
      "mistakes": [
        "没有平均分就写分数",
        "分子分母含义颠倒"
      ]
    },
    {
      "id": "K26",
      "name": "分数比较",
      "term": "三下第七单元",
      "source": "课内必会",